utterance,hat
"Jessica is going back to Holland next week . I've been thinking a lot about what to give her as a parting gift , but I still have no clue .",yellow
Okay . I'll pick you up at 6:00 .,yellow
Great . Where can I get an application form ?,yellow
"Am . Well , can I have a try of the sample free of charge ?",white
"Morning , Mike .",white
"Gorgeous ! There is another song combining Chinese and western music styles . I am crazy for it , so I hear it over and again . And I plan to make it as the ringbone of my mobile .",yellow
"Mike , what are you doing tonight ?",white
I simply can't bear your barbaric behavior .,red
Can I get you some punch ? I was just going to go get myself some .,white
It definitely is a nice change from the polluted and crowded city .,black
"I don't feel like going out tonight , I am way too tired . I miss you , sweetheart .",white
So we can get down to business . __eou__,yellow
So when did all this happen ?,black
Then let me take you out to dinner to celebrate . __eou__,yellow
Excuse me . I wonder if you can help me .,green
What do you like to do in your spare time ?,black
"They sell pieces of fried chicken , you've got to try one this time .",green
I can see digital video products are quickly going mainstream with their plunging price .,yellow
I know . And you can also hear outside noises while you listen to music .,yellow
"I think the government fined him a small amount , and he kept the rest in his foreign bank accounts . He ’ s still a millionaire .",red
"Well , he made quite a few mistakes on the monthly report and when his supervisor found them , my manager blamed them on me !",red
How nice of him ! I'll be delighted to go . But what time would be convenient ?,white
It's a great idea . I can't believe I didn't think of this earlier . Going on a diet with a friend to back you up is a great way to succeed .,green
"I think the government needs a radical plan to improve things . The government just talks , but in the long run , nothing is done to improve the economy .",black
I pressed the emergency button ! And then I stayed in the elevator waiting for the rescue .,red
"No , I don ’ t . I go on a winter holiday instead . I go somewhere warm .",black
"I would suggest roast beef , sir .",green
We ’ re in the same boat ! I ’ Ve eaten fast food the whole week . I hate it now .,red
Sure . Here you are . This one is excellent . Just mix one drop of it with milk .,green
"Well , you asked for it . Why don't you put on an Elvis song for him . He loves "" The King . """,green
"Well . As our sole agency , you will neither handle the same or similar products of other origins nor re-export our goods to any other area outside your own .",black
We could always wait for the next bus to come . __eou__,green
"We're considering of ordering 200 computers , but I'm wondering about the price you'll possibly offer .",white
That is all right . Maybe we can make another arrangement .,black
Why are there still so many people overweight despite the current fitness craze ?,white
"Good , I can see the library on the map .",yellow
"Oh , good . If you could come around six thirty or seven o'clock , that would give us some time to chat a whit over a glass of wine before dinner .",yellow
That ’ s all right . Everyone feels under the weather sometimes . Just finish the rest when you feel well . __eou__,white
Maybe you haven't found the magic .,black
"That's good to know . Oh , listen ! The band's playing our song .",yellow
"No , I don't like museums . They're boring .",black
Perhaps it ’ s in your other pocket .,green
What kind of personal information ?,white
"NYU was my first choice , but UCLA is just fine .",green
The meeting was delayed by thirty minutes and it lasted for two and a half hours .,black
"Actually , the business trip itself was very successful . We arrived on time , we had nice conversations and we settled some important issues for the next year .",black
"I suppose you're right . They also used to think that they were so important that the sun revolved around them , not the other way around .",black
The Cranberries . I love their music . How about you ? Do you like them ?,white
"I didn't do well in last exams . If my father knows it , he will beat me up .",red
Do friends of the bride always sit on one side of the church and friends of the groom on the other ?,black
"I'd like to offer you my congratulations on your birthday and best wishes for your future happiness , good health and continued success . I've asked the Fairy Flowers to send you a bunch of flowers . I hope you'll like them .",yellow
"Yeah ! Where there is a will , there is a way . __eou__",yellow
When did it become CABS ?,white
It was ! But the worst thing was I tore my best shirt .,red
I am really looking forward to getting away from you . Far away from you ! __eou__,red
"Well , dear , we can't force him to go to college . It's up to him .",green
"Oh , no !",red
Shall we keep pur friendship ?,red
"Yes , she ’ ll be working closely with you on the marketing end of things .",white
"Yes , he is . He ’ s very hardworking when he ’ s at school . Then he comes home from school and does homework before dinner . After dinner , he goes out with his friends .",black
"Sorry , I can ’ t ! I have to go to work , pick up Jake and Maddie from school , and make them an afternoon snack , then take Jake to soccer practice and Maddie to dance class .",red
Tell him I hope he's better soon .,yellow
Could I have look at that pair of canvas shoes ? They look nice . __eou__,green
"You've got everyone figured out , don't you ?",black
What makes you say that ?,white
Yes ! Let ’ s go sailing and water skiing . That ’ s so exciting .,yellow
I do it every once in a while .,black
That is easy . You can go directly to Tai'an city and buy a ticket to Mount Tai . __eou__,white
Just alive ? I guess you are some lucky guy . I heard you are going out with Jane .,white
"Hmm . Well , we have some alternatives , if you're interested .",green
You mean that I won't get a raise until the recession ends ?,red
Tim ’ s smiles are interesting .,yellow
I wonder what it ’ s going to be like tomorrow .,white
has anything else happened to you ?,black
no problem . I'm really looking forward to the coming week .,black
This is a pity ! __eou__,red
I love ice cream .,white
That's quite good . Thank you for telling me about those . __eou__,yellow
"I like Business Management , and i think it's very useful for the present work .",white
I'll be back in a sec .,yellow
I am still young . And I'm growing every minute .,green
That's rock and roll with fast tempo .,yellow
"Oh , there are many Chinese antique stores . They get paintings , too . Do you get interested in them ?",green
Do you know that I fell in love with you at the first sight then ?,yellow
It was a foreign film called ' Gone with the wind ' .,black
Let's take a cab . __eou__,green
Is it cold in autumn there ? Should I take any warm clothes with me ?,black
But there's no hot water after 10 at night . Sometimes I like to have a hot shower before bed . especially in the winter . It feels good .,green
Maybe 500 dollars .,white
Something made in the ' 20s would be nice .,green
"Well , black people are supposed to be great dancers .",yellow
"Oh , no , I'm afraid not . These things are just too old to guarantee anything .",red
I have three years of teaching ESL and four years of teaching per-school children .,black
"No , it's also necessary to list a few related interests that are in some way connected to the jobs you want to take .",black
What about cab drivers and porters ?,green
"Of course they do.You know , Eliza , before I went over there I thought the same thing . I thought that maybe kids in Taiwan study too much.But now that I've worked there , and taught them , I feel it is a good thing.Their parents are very concerned about their education . More than American parents are . And that is good . American kids don't study enough .",black
"Yes , take your time , please .",green
"Is that you , Dave ? Oh , my gosh ! The backstabber who left us to work for the evil WebTracker !",yellow
"Honey , please forgive me . There is lots of work to do . So , I forget your birthday .",red
"Right this way , Mr . Mason . We can start with our front office . When Ms . Terry is ready , you may take the elevator at the front to the 6th floor.There is a conference room already prepared . __eou__",black
"Oh , they are playing the wedding March . Here they come .",yellow
"He is five years older than me , He got married last Sunday.My brother and my sister-in-law are the same age . __eou__",black
No . But I write to them often .,white
What do you do in order to improve your English ?,green
"right now , there are three bedrooms , two barrooms , a kitchen , a sitting room , a dining room , and a living room . We're hoping to add on a green room and a guest bedroom . In fact , when the guest room i",green
"Well , that's easy . Walk up to him and kiss him .",yellow
"What about Mao Tai , one of the most famous liquors in China ? It's good indeed . It never goes to the head .",green
How can we get there ?,yellow
"Thanks . Now , I have to find a job .",yellow
That Italian restaurant in the city centre always has large portions . Do you want to go there ?,black
"Yes , that's exactly the bug I got . Though , I do kind of like the pictures .",white
"Yes , I agree . We can see the scenery better . In a bus , all you see are the roads .",green
Could you do something to advance your time of shipment ?,green
Working at weekend is something I hate to do most .,red
"It is so popular among people to preserve health now , so I read some books about health food .",green
"Oh , I see .",white
but we've done that many times . We want something fresh this time .,white
"Well , the website handles a point system where if the seller does something wrong , people comment negatively and then you know that he or she may not be trustworthy .",green
What a pity ! I missed it again .,red
How about the Korean restaurant next to it ?,black
I can ’ t believe it . I guess I ’ ll be here until 10 again tonight . __eou__,red
"Oh , that will be great . Thank you so much . Please help me to double-check the name list . I have to make sure they are all correct .",black
"then what about tea ? We need to bear in mind in the first place that tea , rather than coffee , has been the most popular drink for the Chinese people .",green
Have you gotten any interviews yet ?,black
"I see . Look , do you know what that emblem means ? I've seen it so many times , but I don't know what it stands for .",green
"Hey , wouldn't it be great if we could go to Thailand together sometime ?",yellow
We can hold them until one day before the show .,yellow
You may check out books or videos .,green
A foot massage sounds like a great idea . They are very relaxing . I ’ d also like to have a mudpack on my face . It ’ s supposed to help with your complexion .,yellow
"I like a family composed of many people . It includes grandparents , parents , aunts and uncles , and children .",black
"Oh , ISEE . So factory tours are good for companies as well as visitors .",white
I think dimes and quarters will do . __eou__,green
Good . Tonight 8 o'clock .,yellow
"Cindy , how come nearly all the prime-time TV shows are comedies ?",white
"Let me go to school , please ! I'm sick of medicine , sick of soup , and sick of being sick ! __eou__",red
You can take a bird-eye view at the glorious picture when you arrive at the top of the mountain .,black
Of course . I spent so much time at my old workplace that I got to know them all very well . They were like family to me .,black
Let's stop it at Multicolor for a quick lunch ..,green
Harris and Anne are perfect for each other .,yellow
That ’ s understandable . Every kid likes new clothes .,green
"I understand that , but you'd feel better if you took a break , even for just a short while . __eou__",white
"Of course we need a house inspector . But we can hire an inspector on our own . As for the legal problems , I have friends . They can help us .",green
Hmm . I think I should ask some of my friends for advice before I make a decision . I'm sorry .,red
Of course . We both experienced a good cooperation .,white
"Yes , I nearly didn't sleep last night .",black
OK . Bye .,yellow
"It's hard to be optimistic about things with the way the economy's headed ... The trade deficit is getting larger , consumption's down , I really think we're headed for a recession .",white
"that's quite a bit . If I give you a raise , I'm going to have to give everyone a raise .",white
I intend to stay at home for the whole seven days and have a good rest . __eou__,black
"Because the company is far away from home , and I have to study after work so I can't afford to waste time on the road everyday . __eou__",black
"I just can't help it . Oh , look at Clive , he is really a big hit . They are definitely gonna win .",black
We don't get along well with each other and fight a lot .,black
"Quite well , thank you .",yellow
"That's the beauty of it , and the danger .",green
"Look , traffic jam again ! __eou__",red
"Why not ? Our cannedlichee and canned provisions have already been widely sold in various markets abroad , and the Ma Ling Label has now been accepted by most of overseas customers and importers . Is it quite impossible for you to use the Ma Ling labels as they are ?",green
"Yes , I finally have an inspiration .",green
"Hi , Sarah . The results of questionnaire have come out . We need to discuss it together then write a research report .",black
How about some Zongzi ?,green
I ’ m glad they ’ re coming in August . Maybe Greg and I can play some golf or get tickets to a baseball game .,yellow
I've been waiting here in the conference room for ten minutes already . What time does our meeting start ? Where is everyone anyway ?,black
"Sure . It ’ s indeed a culinary heaven which offers a wide range of delicious snacks to satisfy all tastes . Then , which one would you like ?",green
How did you find him at last ?,black
I don ’ t think they are right . I have tried my best and that's enough . It is unfair that they are always saying these thing . Sometimes I even feel deeply hurt . __eou__,red
"I have it on highest authority that this traditional secret recipe has been handed down in the Granger family for generations . I ’ m sure you can keep a secret.Buttermilk , cacao beans , sugar and Haggis .",black
I am calling to ask about the position of an usher .,white
"Well , I also have ... __eou__",green
How long have you been in China ?,white
Let ’ s see ... “ Wanted,green
"Your idea may be a good one , but the trouble is that there are risks of pilferage or damage to the goods during transshipment at Hong Kong . How about shipping them from Seattle instead of network ? You may choose either one as port of shipment . It makes no difference to us . There are more sailings from Seattle than from New York .",green
You can ask the teacher for help .,green
I don't know . The weatherman didn't say anything about this in his weather report last night .,black
"Actually , what bothers me is the violence . There are far too many detective and police shows .",red
"Because it hasn't been copyrighted . We want to get some protection for it.But while we wait for copyright , we are investigating companies to produce the products .",black
I think you have a very good chance of getting a visa . I can help you prepare for the visa interview if you want .,green
"ordering a lot of food at restaurants is just a tradition in China . You know , in the past , people could not afford to eat out like they can today .",green
How's the weather today ?,black
Ashes to ashes and dust to dust ...,red
"Yeah , good idea.We can put some lawn furniture outside next to the grill . I also set up the tent outside so we can hide from the sun if it gets too hot .",black
"Oh , the final exam is coming soon . I feel a little bit nervous .",red
All right . Can we make it another time ?,yellow
He is such a handsome guy . He gets his looks from his mother of course !,black
I know several . But wouldn ’ t it be easier to take the shirt back and exchange it for the right size ?,white
I'm a little nervous .,red
"200 Yuan a week , but smoking is not allowed .",green
That ’ s all right . Thank you all the same . __eou__,yellow
"Well , when it's nicer outside , you can start biking to work . That will give you just as much freedom as your car usually provides .",green
Would you like to drink some coffee ?,white
you're dancing so well .,yellow
You mean we Chinese think differently from the Americans ?,green
That's too bad . We could really use someone who is bilingual .,white
"I am sorry , sir . But may I see your driver's license and insurance policy , PLS ? I have to give you a ticket .",red
I will . Merry Christmas . __eou__,yellow
She's pretty and meek .,yellow
Marvelous idea ? __eou__,white
OK . I'll try a Pinto . I want to rent a car for one week .,yellow
I'll need a few minutes to check over my notes again on every detail . What about the quality standard ?,black
don ’ t say that yet . A new project could suddenly appear .,white
We have too many cars ! __eou__,red
"I'm sorry , Lucy . I'm afraid that I can't get up .",red
you're kidding me ! that sounds really scary !,white
"Thank you.Thanks to the baker , I benefit a lot from him . __eou__",white
We'd like to have typical Chinese food .,white
Why not ? Come on ! Just a cute little puppy or a kitty !,red
"Sometimes it is . But after working for a few weeks , it ’ s easy to figure out .",green
"Maybe just a quick sandwich , salad , or something .",green
"Hello baseball fans , and welcome back to today ’ s game ! My name is Rick Fields and of course , I am here , once again , with the man that seals the deal , Bob Copeland .",yellow
Then why did you leave ?,white
"Where have you been , Alice , you're over an hour late .",red
"Granted , it ’ s cheap , but the place is filthy , the beds are uncomfortable , there ’ s no A / C , the breakfast is pretty skimpy ... and the staff couldn ’ t care less about the guests .",red
It ’ s so nice and quiet in the woods .,yellow
"How about the lunch break , Lucy ?",white
nothing particular .,white
You can yell at them .,red
I think it's dangerous . What if I can't turn it off ?,red
I see . What else ?,green
At 10 o'clock .,white
"No , it is the original one .",white
"Hi , Ms . Seymour ? It ’ s Allan Parker . I ’ Ve been waiting to call you and thank you for all your help last week .",yellow
"Yes , sir . It is Jane . It was given by my English professor when I was at the university .",white
"Well , I love it . The room is spacious and clean with big windows and a lot of sunshine . There are plants along the corridor . Especially , I got my own desk with computer and telephone . Such a great place !",black
So why did you decide to resign ?,white
Probably not .,white
Someone brings a truck to the game and we have a barbecue right there in the parking lot out of the back of the truck !,yellow
"Fine , we will take an actual look at your kitchen before start working on it .",white
I have no idea . Let me take a closer look at my museum map,yellow
"Well , I ’ d like to , but I ’ m going to have to look at my schedule . __eou__",white
"Yes , they do . Do you have a Christmas tree this year ?",white
I think perhaps I need to buy a few years while I figure out about my career .,green
Don ’ t worry . I will arrange everything .,yellow
That ’ s for sure . You ’ ll know our products better after the visit . __eou__,white
yes . I have so many clothes stuffed into it . Perhaps I should get rid of some of them . There are clothes in there that I never wear anymore .,green
"Sorry , sir , we are having a sale now . __eou__",red
"it'll be sad to see you go , but it sounds like you're found yourself a great opportunity .",white
"The shoes can be comfortable or not comfortable , too wide , too narrow , or just right ; and long or short . In girls shoes , the heel can be high or low .",green
You haven't told me anything yet .,black
"OK , let's go . __eou__",yellow
"I think I will call the office to send someone to meet us , and escort that person to the nearest hospital without interrupting our trip .",black
Why do you ask me these questions ?,black
"Well , what about this Thursday evening after we finish the weekly meeting ?",black
You will be very beautiful on your wedding day .,yellow
That would be our Savers Plus account . You must pay 10 000 yuan into your deposit account . In this way you can get 5 % dividend at the end of the year .,green
You are doing the waltz wonderfully well .,yellow
How about Saturday morning ?,yellow
"I mean , what ’ s up with the locks and iron bars on your windows .",white
"Hi Tom ! I'm fine , and you ?",white
I haven't made up my mind . Maybe I will go to the US . What about you ?,green
"All I know about soccer is that you can ’ t use your hands and that players are always falling down , trying to get a free kick or penalty kick . It seems like a sissy sport to me !",red
That's why I like department stores more . Shopping at a wholesale market like the locals is one of the few things I am unable to grow accustomed to .,green
Listen to the sound of nature ! It's like music .,yellow
I ’ m really lucky to do something I really love .,yellow
how about cats ? Have you ever had one for a pet ?,green
Shall we sing with a karaoke ?,yellow
"Ok , each player gets 16 pieces . You can be the white ones and I ’ ll play with the black pieces . Now in the front , you set up the pawns . Those are the least valuable pieces and can only move one space forward . When you are about to capture another piece , it can move one space diagonally .",black
"Aw , come on , it was nothing . I'm just doing my job .",yellow
"Oh , no . But cheese is the best thing to go with red wine . And we have really fresh cheese which will be free if you order red wine . Here are the pictures . Pick out something you like .",green
I ’ Ve just parted with my boyfriend .,red
"I would like to make a suggestion then , sir .",green
I think I will be adapted to it .,white
"Yes , I did . There ’ s an anti-virus program with my email account that scans all attachments , so I ’ m sure I haven ’ t sent anything nasty to anyone .",white
I don't go to parties . The parties I go to are the barbecues I have in my house . Being seen in the right places is something that I don't believe in . I don't believe in going to events just for the sake I of being seen .,black
"Oh great , I ’ ll see you there ! __eou__",yellow
"Can't you wait till you get home ? then you can surf the internet using the broadband , wireless connection or whatever you like .",black
"Darling , can't you stay for a few more days ?",red
Of course Mike . Who else ? We fell in love at first sight .,yellow
I hate computer games .,red
So what am I going to do ?,white
Nowadays fewer and fewer people go to the movie theaters to see films . So I am afraid that the film studios are really getting hard time to survive .,green
"Yes , thank you . I ’ Ve already been helping myself .",white
Good . I think I'll get too nervous to look at myself in the mirror !,white
I think I should go . I really need to lose some weight .,green
"Oh , man , look at her , go ! She is amazing ! She should be my sis .",yellow
We'd like to have western food today . Could you tell us something about it ?,green
"So , have you seen all three The Lord of the Rings movies ?",black
How awful ! Was he hurt ?,red
He's a very creative painter . His paintings sell well .,yellow
"Tom , if you can hear me , I think we ’ Ve lost you . There ’ s a problem with the line . Let ’ s try again . We ’ ll call you .",black
Thank you . I am very happy to have my own office now . I ’ Ve never had one before . It is very nice .,white
"This room is unfit for humans . I want another room , and I want a refund for tonight .",red
Then shall we keep pure friendship ?,red
"OK . It's 15066688866 . Call me ! Bye-bye , then .",yellow
All right . Let me prepare the supper . __eou__,yellow
"If I remember , he got off with a light sentence . Something like three years in a minimum-security prison .",red
"Admittedly , I hope it is a job in line with my specialty . But I will make the best effort to do the job whatever is assigned to me .",white
I don't know . I only started looking for a job a few days ago .,black
The river in my city sometime freeze over . People go ice-skating on it . In summer people go boating on the river . But few people go swimming because it is not very clean .,black
did you have a fight with Jack ?,black
"Because I'm the wrong sex , of course !",red
Why didn ’ t you just answer my question directly ? Why would Chinese answer questions this way ? I simply asked if you did it or not . It ’ s a very simple question . And Chinese often give the reason before they would give a direct answer .,red
"Not necessarily . If we use a realtor to find a house , it will be more expensive .",green
"She's doing great , she's getting her confidence back , and her self-esteem , has improved drastically.She ' s very happy .",yellow
"Yeah , or the expensive Italian facial treatments . __eou__",green
"Let me suggest this one . It's an excellent watch , it looks good , and it's only $ 100 .",green
"Yes . How are you , Anna ?",white
Why not go to see the doctor ?,black
How about the seaside ?,black
I got laid off today .,red
Of course ... here you are . I'm sorry the pajamas didn't work out for you . __eou__,red
What is the special local product ?,white
"There ’ s a real mix of stories in the book . I haven ’ t finished all of them yet , though . Many of them are short detective stories , but there are also horror stories and sci-fi ones . If you give me your",yellow
