utterance,hat
"yes . Last Sunday I went to a nearby market . It was on open-air fair . I chanced upon this bag and bought it on the spot , without even trying to strike a bargain . I paid one hundred and twenty . And just now I was told by my Chinese colleagues I bought it overpriced . I could have talked my way to thirty .",red
This one comes with its own folding keyboard . It has a pre-installed handwriting recognition program . I can use the stylus to write on the screen .,yellow
"We can go fishing , chatting and camping .",yellow
Let's say about 6:00 ?,yellow
Oh yes and try lots of new food too .,green
Yes . I am going to have a summer vacation . Would you recommend some scenic spots to see ?,green
That ’ s so unfair ! __eou__,red
"Yes , it's me .",white
How is the new product ?,black
"Of course , I should have been more careful . I ’ m sorry . __eou__",red
"If I were in your position , I wouldn't give up an inch .",green
A growing keep-fit fever is sweeping over China . __eou__,yellow
A really dreadful accident and many people were killed .,red
"I know , but sometimes interviewers just want to hear you say it . Then you may be asked for your viewpoint on why you feel you are qualified for the job , give them all your qualifications and how you think they will fit the position you are applying for . Questions like what sort of experience do you have and what are your goals ? are closely related to this .",white
What will happen to the children if you break up ?,black
Do you think they'll become reconciled ?,white
I think they must have horrible lives . All the paparazzi take photos of them wherever they go and whatever they do . They must get sick of it .,black
I saw him last week . It seems he was a bit queer in the head .,white
"OK , I just want to brief you all on the travel market in Taiwan . To start with , generally speaking , the travel industry in Taiwan focuses mainly on tours . This segment of the industry is well developed .",black
Good . Let's shake hands on this successful transaction . __eou__,yellow
I thought you'd be a bit more excited about this . Everything will be paid for and I'll send my assistant with you to take care of everything for you . All you have to do it get on the train tonight a,black
Light music and classic music .,yellow
Do you prefer to work alone or as part of a team ?,black
Amazing ! I can imagine the feeling when I hear the smooth tune around my ears . __eou__,yellow
"No , I don ’ t think so . I know Mary . Once she makes a decision , she won ’ t change her mind .",white
"What ’ s wrong with climate ? Anyway , I think the sand storm happens more frequently these days than the years before . Can ’ t people do something to stop it ?",red
It's not what you're thinking . These events will give us a wider exposure than most . Take the tri-city marathon for starters . This is a highly publicized event . The television exposure alone will nearly double our customer awareness .,black
"Hi , Bob , this is John Lin .",white
I'm happy to help . __eou__,green
Has your family lived here for long ?,black
What should you do if you find out a man may has an illegal departure in exit control point ?,black
"No , it hasn't . It's very dirty .",red
That ’ s all right . __eou__,yellow
"Since we're late , let's go to see a film .",white
I just heard that you won the long-distance race . Congratulations on your victory .,white
We established the strict QC standards and we have followed it for about five years with good results .,black
Thank you very much . I will devote all my efforts to my work . __eou__,white
What was the most important thing you have learned at work ?,white
It ’ s the worst thing I ’ Ve ever tried . __eou__,red
"But wait , wait , will there be food that is not meat ? You know . I'm a vegetarian",green
"Sure . There's network of canals . And there are white walls , black tiles , small bridges , flowing rivers , flagstones roads , blue sky and white clouds . Few places have preserved the past like this place . Walking on the ancient road makes us back to our sense .",green
Well . There's a beauty contest in Thailand just for fat beauties .,green
"Yes , I'd like that , then .",green
"It's just too bad . I have to leave it as it is , and thank you just the same . __eou__",red
"Since last time we've climbed the mountain , we haven't gone out for a long time .",black
I can't remember that clearly . It probably be Charles ...,green
"Thanks , but I know falling in love is one thing while staying in love is another .",yellow
Take care ! Don't slip on the ground .,yellow
May I see your ticket please ?,white
"Well , the brown one is beautiful indeed , but I think the black one will suit you better .",green
Gosh ! I can see the flames !,red
that's nice . What do they have you doing over there ?,white
Here's 30 yuan for my ticket .,white
I ’ m so happy to hear that ! I knew we belong together . I love you so much . __eou__,yellow
"Yes , quality is even more than the quantity .",green
"if you study hard , I don't see why you wouldn't . Have you received any other offers ?",green
"Oh , she is going to be a great mother . __eou__",yellow
Nothing . It's just one of those days . Everyone at the office is sick and I'm getting blamed for work not being done .,red
"Come on ! In the two hours we've been here , you haven't sung even one song !",red
Yes . You know I ’ Ve been cooking more kind of food recently and I needed some extra space for spices and ingredients .,white
Thank you . Same to you .,yellow
"You didn't read their brochure or anything , did you ?",black
"Yes , I do . Go on .",green
"It belongs to the past . He lost his job the other day , and he ’ s up a tree now .",black
"No . That is something only true Catholics do.So if you come to the church as a visitor , you only listen to the service.But you shouldn't go up to the altar for the bread and wine.Only after someone joins the church , then they go up for the Eucharist .",black
I can't stand being with you any more . I'm sick of your drinking .,red
maybe it is for the best . They are not suitable for each other because they have nothing in common and are completely different people .,green
Fine . I ’ ll take the compact .,red
No doubt about it . Shopping online will get more and more popular . It's a real revolution about people's consuming habits .,green
I ’ m ready and willing to help . __eou__,yellow
"They are just been in friendly , when you are in Roman , do as the Romans do , that means you need to adapt to your enviroment .",white
Very much.What time ?,yellow
I have some problem with my work .,white
You haven't spent much time with Sophia lately . Are you speaking to each other at the moment ?,black
Where did you end up going ?,yellow
That ’ s all right . Hope you can do better tomorrow . __eou__,yellow
Thursday mornings are usually the slowest around here . Why don ’ t we set it for Thursday at 10:00 a . m . ?,green
"The weather is good now , but I think it's suppose to rain this afternoon .",yellow
"After the trouble I got into last year , no way .",black
"What do you think about the "" impossible is nothing "" billboard on the high street ?",white
Can you see what his schedule is like on Wednesday ? __eou__,white
"For me , growing up in a big family always made me yearn for attention . I always wanted to be an only child so that I could always do what I wanted and so that I wouldn ’ t ever have to share .",black
I ’ m pretty sure that Jim will turn out to be a good lawyer .,black
Nonsense ! There's no indication that he's in love with me .,red
I would like to know if there would be any opportunity to work abroad in the future ?,black
"Oh , Kate ! I ’ m sorry . It completely slipped my mind !",red
"Sorry , but do not worry . I think I can fix it . Just cut a little more off the temple .",red
"Oh , don't talk to me about laptops . Mine crashed on Friday and I lost everything . I hate them .",black
What is the difference ?,black
"Yes , I used to work as an assistant lawyer for Tienda Law Office . __eou__",black
It's the fourth one this year . Isn't it horrible .,red
"Yeah , I'm eager to learn Chinese , but it is too difficult for me .",white
His parents must feel very happy . __eou__,yellow
I can't believe this for it's been 20 years since we got married . __eou__,yellow
We thought it would be fun to have a pool party at Jay's house .,yellow
Shall we need at one fifteen this Thursday ?,white
I suppose you like cinematography and costumes and that sort of stuff ?,black
It's seriously good . __eou__,white
What are you and Corey doing for Valentine ’ s Day this Friday ?,white
The counselors were so nice too . It was the best summer ever . Except for all those mosquitoes ! __eou__,white
That wouldn ’ t be a lie ! __eou__,red
Good . Now you can pick classes by yourself . __eou__,green
Rock music really leaves me cold . What about you ?,white
Do you really think the Dalai Lama sent that ? I'm tired of all these forwards .,red
Well I ’ m definitely a team player as well as being highly self-motivated . I believe this company can fulfill my long-term goals and offer me great upward mobility . Therefore you will find in me __eou__,white
When I quarrel with my husband . He didn't even try to cool me out .,red
I am sorry I am so late to work .,yellow
"It's too difficult to park your car in the city . Also , the traffic coming in from the suburbs is a nightmare . __eou__",black
Did you play football yesterday ?,white
"Honey , I ’ ll be right back !",white
We haven't had any problems so far . They offer a 24 - hour technical back-up service . We've called them in three times this month . They always arrive within a couple of hours .,black
"All you need to do is fill in the blanks correctly on the Continued Claim Form , and the EDD Office will take care of the rest .",black
It seems to me that you are on very good terms with him .,white
"We sing "" Happy Birthday "" at the party and have birthday cakes .",yellow
"Yeah , it ’ s gonna take you a while if you go by foot . I ’ d say it's about a 30 - minute uphill walk . You have to be as strong as a lion to make it .",green
I don't understand why I'm being arrested .,red
"Women have often played an important role in British history . Queen Elizabeth I built a navy strong enough to fight off the Spanish armada in 1588 . more recently , Margaret thatcher transformed british society in the 1980 ’ s .",black
I am afraid I can't I am going to be out all day .,red
The seats are excellent . We're right in the center .,yellow
I had some good financial news yesterday too .,white
His son is coming as well . He wants to go to university here in England so they will visit a few universities while they are here .,white
I have said that we will try our best . You can trust us . But you know her situation .,red
"Great ! I'll sing , and you can dance in our band . __eou__",yellow
"Great ! I must warn you though , whatever happens , don ’ t let me go on a drinking binge . Trust me , it ’ s not a pretty picture ! __eou__",yellow
What are we going to do now ?,red
Of course . First dial the code 011 to get an international line . Then you dial Taiwan's country code,green
"yes . One bedroom is for my wife and i . there ’ s another for our daughter . My wife wants to use the third one as a guest room , but I ’ d like to make it into a study . Our daughter is also keen on",green
"yeah , I quit my job , and started working from home . Recently I've got a project to deal with and don't have much time to work out .",black
That's fine . Then let's sign a contract . __eou__,yellow
Better than ever ! You won ’ t have to worry about “ finding ” extra money for me anymore ! We made nearly a quarter of million in profit last year !,yellow
"Well , I studied French at school , but I ’ Ve forgotten most of it . I learnt some Russian while I was studying there and now I study Spanish in evening classes . Do you speak Japanese at home with your pa",black
Don't mention it . It's been my pleasure .,white
"OK , but don't believe everything you see on The X-files , either !",white
"Oh , I've forgotten to tell you . The party is held every other week . And every family gives their own performance each time .",yellow
Cindy . We were going to try to surprise you for your birthday . But you ’ re just too busy ! Can you tell me when you ’ ll be free ?,black
It's unfair .,red
"I have four years study in the Department of Mechanical Engineering and it has given me a solid theory foundation . Moreover , I have worked at CAB Company for 4 years and got a lot of practical experience .",black
"I have to see the dentist . We have an appointment for this morning from 9 to 11 o ’ clock . So if there is any phone call , please pick up for me . If there is something urgent , tell them I will be back in two hours .",black
"Yes . If we get it , we'll really be set for success .",white
"All right . By the way , do you often dance ?",white
"Oh dear , I ’ m late . I have to be in the office by 8am .",red
So uncle Bill's wife is Jane's mother but not Sarah's mother . Right ?,white
"No , I ’ d rather go out . The Chinese food here is rather different from what I had at home . Maybe we can try some other food today ... What about that all-you-can-eat place we passed the other day , the one over in the shopping center ?",green
Let's play some music ! I feel like dancing .,green
I can ’ t stand being with you anymore . I'm sick of your drinking .,red
I understand that . But I hope that we can get to the bottom fo this and show Miss Brown that she misunderstood my reaction .,black
Do you mean the one near the health centre on Old Slate Road ?,black
I'm waiting ...,white
Absolutely . She's a teacher of aerobics . __eou__,yellow
I'm so nervous about this oral test .,red
"The movie starts at eight o ’ clock , so we have plenty of time to eat and get ready .",black
"Yeah , I got to eat as much pizza as I could for free . __eou__",white
Yes . It says it will be sunny all day . No sign of rain at all .,yellow
It will be the best as long as the weatherman is right . __eou__,yellow
Hey man ! How ’ s it hanging ?,white
"I am Mr . Foster , and we have a 7:00 dinner reservation tonight for four people .",white
Enough ! I can't wait anymore . __eou__,yellow
"No , that ’ s perfect . We can leave directly from here . __eou__",yellow
Excellent . I ’ ll see you on Thursday at 9 30 . __eou__,yellow
"well , let me know when you can get it fixed . I ’ d love to go for a ride in it ! __eou__",yellow
Please find out the reason as soon as possible . We are in bad need of it .,black
"Come home late one more time , and you'll find your stuff outside .",red
How depressed ! __eou__,red
"Can I have the ticket , please ? __eou__",red
It seems that nobody can always expect things to pan out well each time . __eou__,white
"It's exciting news ! If we find a second solar system , we might find a second earth !",yellow
"So , now we have covered all the important points .",black
Great . You can help me a lot with English .,green
"we spent that afternoon walking around a flea market . We had a few coffees , watched a movie , and went for a swim in the pool at the hotel .",black
"well , my boyfriend was supposed to call me last night , but he never did .",red
No wonder your English is so good .,yellow
You are pretending !,white
"it's a popular game with some people , but I've never played it .",black
"Definitely , I ’ m really sorry . __eou__",red
"Oh , come on , Ultraman !",red
"Sorry , I can't give you an immediate answer on the matter . It's pending now .",black
"Well . there're actually over 200 kinds of folk collections in this city . That's half the collections of antique objects in China . There's one exhibition half for multiple collection , and several individual display rooms for private collectors .",black
"Well , I go jogging every morning , eat a healthful diet and work out in a gymnasium twice a week .",green
For God's sake ! It's too bloody . How can people be so cruel ?,red
What about this one ? It sells like hot cakes .,green
I'm going to see the doctor this weekend .,black
"Yes , five to six weeks .",black
Thanks for encouraging me . There are problems cropping up here and there . But I will overcome them one by one . __eou__,yellow
It's kind of you to meet me at the airport .,yellow
"Ok , I'll try that .",white
"On Friday morning , Mr . Wang , the director of Shanghai Research Institute , will visit you at the hotel . In the afternoon , you will discuss some problems with Mr . Yang , vice manager of computer corporation .",black
"Seriously , if we will adopt any animals , we'd gotta to talk to Daniel .",green
I'm glad you saw the reason . __eou__,white
"But you like a girl to be rich , surely ?",white
Can you tell which team seems to win ?,black
That's true . I should make sure my wife and baby stay healthy during this time . __eou__,white
Right . You can ’ t blame the tv stations for showing popular kinds of programs . They need to make money from advertisements shown during and between programs .,black
I ’ Ve ever seen a living being looked so thin .,white
"David , Chou .",white
What kind of business do you do ?,white
"I am doing great ! Thank you for asking , Joe .",white
"It's something relative hackers . I often hear people talking about them , but I don't know much about them .",black
And my writing is not good . I feel so frustrated .,red
The pile is over ten feet high . I am afraid it will fall all over and bury you underneath it if I put this file on top of it .,black
"I main market reasearch , and you ?",yellow
"No , I don't . I just don't know how to handle this . This is my first time , you know .",red
So we should take the advantage of it . __eou__,green
That is right up my alley . You say party and I'm there .,yellow
"It's me , Ali . There's this strange guy who keeps coming around . He's been here three times this week .",red
I hear scientists in the US have discovered a new AIDS vaccine .,black
"Yeah , oh my god ! It's still there . We have our first date right on there .",yellow
Pretty good . I ’ Ve just had my new poems published .,yellow
Come on ! What have you got to lose ?,red
"Actually , would you mind looking after my pet tarantula and snake for a couple of weeks ?",white
And they lack originality . Talent shows like ' Super Girl ' and ' Super Boy ' are largely clones of ' The American Idol ' .,green
The form has a map on the back . You may specify your top four choices.We will give a spot in the lot that has an opening .,green
"Hey , Mary , nice to see you again . I heard you're going back home to the U . S .",yellow
"Well , maybe I can help . Remember my neighbor ?",yellow
"Willing to help , maybe , but not as helpful as you think .",white
How do I look in this new dress ?,black
even the roller coasters that go through tunnels in the dark ?,green
I'm phoning about the factory visit next Friday . What should I do when I arrive ?,black
"Now , move the couch around and turn it upside down .",green
Would you like to have dinner with me tonight ?,yellow
"Hi , Ellen ! How is it going ?",white
He always likes to say something as if all his geese are swans .,black
I could teach you how to cook something healthy . Frozen pizza are so bad for you !,green
"I had a pretty strict upbringing , and my parents taught at universities so they have extremely high expectations for me .",black
"just give me the dates and I'll make sure I'm free . You know after all these chatting online , it will be great to meet you in real life . I look forward to seeing you soon !",black
We'll have to talk this over some more . __eou__,white
"Nope , I ’ m canceling my appointment so that I can stay here with you . __eou__",white
Thank you for calling me . I will be there on time .,yellow
"Well , you made a good choice . Coming to us , I mean . We have a full range of products from cosmetics to skin cleansers and moisturizers .",green
"I ’ Ve got all the presents I need , and my family is working together to get all the food ready . That ’ s easy ; but I have another problem to deal with .",green
What do you think of the new television channel ? Aren't the programs awful ?,red
He must be all over you the first time he saw you .,yellow
not a single email until now ? it's already twelve o'clock . I can't believe it !,black
"It is said that the Cowherd and the Spinster , the lover stars in heaven , can only meet on the seventh Eve , so this day has become the Lover's Day . __eou__",green
"Every day I have less money ! I haven't spent anything , it is just melting away because of the shifts in exchange rate .",red
Is this where we'll be holding the meeting ?,white
Do you think I believe the story like that ?,red
Indeed . He's strict with himself too . We can see every lecture of his is well-prepared . __eou__,green
Professor Wang looks so handsome today . He is wearing a light brown suit and a pink tie .,yellow
"That ’ s really interesting , you have to play for me some time .",yellow
"Soup does the body good , sweetie . It's what you need when you're under the weather . __eou__",green
"Oh , I see.Thank you . __eou__",yellow
"Well , in fact it's fun for us to just be together that night and do this one thing .",green
"Well , I came to know a girl three weeks ago . We have so much in common .",black
And what about the number of people on the streets ?,black
Those guys thought they would never lose . But we finally beat them . And look at them crying now .,yellow
I stayed in L . A . and it was sunny the entire weekend . We spent most of the time at home but we did go see King Kong on Christmas day .,black
How do you know that I didn ’ t try ? I just couldn ’ t manage it . __eou__,red
I'm afraid it is . So you will have to pay two yuan extra . The total charge is four yuan .,red
I had a wonderful time . __eou__,yellow
"Yes , look over there . That's the Empire State Building . My book says it's 102 stories tall .",yellow
That's unbelievable . Why did this happen ?,white
Isn't there anything that sounds fishy ?,red
"Sorry , we ' re sold out right now.Please come back next week .",red
Let's go and try now ! __eou__,yellow
"Anthony , you were caught making international calls from the office phone , you called in sick in eight times this month and you smell like alcohol ! __eou__",red
That is what I want to say .,yellow
"Oh , you are such a dog ! __eou__",red
All right . I'll get it . __eou__,white
"That's true , I guess . If I didn't have to work , I think I would be happy .",white
I'm sorry . I can't . What does the note say .,red
Then he become angry with you ?,white
For crying out loud ... How fast are we losing money ?,red
"Yeah , that is the holiday is hot , isn't it ? __eou__",yellow
They suddenly become shy when they speak to boys .,green
Your knowledge of English is really surprising .,yellow
So what ? It only makes her look cheap and vulgar .,yellow
I'm scared that she might not come back .,red
"Come on , Dad , I need thirty thousand . I wanna get into the market . You know , I ’ m tired of hearing all this news about the economic downturn , the inevitable recession , people stuffing their money in their mattresses . I look at this as an opportunity . This is a chance for me to get a jump start on building my nest egg .",green
How do you think the education you've received will contribute to your work in this institution ?,white
"It's my health-conscious lunch , good for my health and beauty .",yellow
"And so , that concludes my outline for our marketing strategy next year . Thank you very much for your time .",yellow
"No , Miss Anna , you must let me say how lovely you are ! What's wrong with that ?",yellow
Sorry . __eou__,red
"Yes , please . __eou__",white
It would be better if you watched out for yourself . I might forget . __eou__,green
Your tie is handsome .,white
How about the new bar across road ?,black
Congratulations ! This is your first interview ever .,yellow
"Ok . This is your cubicle . At first , you ’ ll be responsible to me . Later , you ’ ll be working more independently .",white
Is she coming ?,white
"I am sorry , we will change yours for a new one . __eou__",red
Is it possible for someone to come a little earlier ?,green
It's really very easy saying you're sorry .,red
Just what ? Stop beating around the bush . Tell me what you want to know .,black
That's OK . I'll have a glass of water .,yellow
Good idea . It is convenient and fast .,white
Our usual supplier has let us down and I ’ Ve been looking through your parts catalogue . I need fifty GT670s . How soon can you deliver ?,black
"You know how much I want to be on the team , and now there is an opening for me.If I don't go to practise today.They ' ll get someone else and I'll miss my chance .",white
"Oh , you mean palm reading 5 . I've seen that before , but I don't believe in it .",black
"I'm going to work with my father at the store . In the evening , I'll read books.On weekends , I'll go to the beach with my family .",black
That's what I do .,yellow
My wife gave birth to our first child today .,yellow
"Well I always hear it on the radio , so I started to get into it .",black
That is truly amazing ! __eou__,white
"Well , thank you very much but I thought l'd try and chair the meeting by the rule — at least for a while .",white
That's great . Thank you very much . __eou__,yellow
"Well , it's just that she put a lot of makeup on her face . Actually , natural beauty comes from within .",red
that's good to know . Why do you think you ’ re qualified for this position ?,white
For the bank manager ?,white
We have read about this in your sales literature . Could you give us some idea of your prices ?,black
Great ! I can't wait . __eou__,yellow
I'm afraid he's away from his desk at the moment .,white
