utterance,hat
"Thank you , Rick ! As you can see , ladies and gentleman , we are here in beautiful Pebble Beach where the top golfers in the world are trying to win the grand prize of one million dollars !",yellow
"I require 6,500 RIB per month as a start . This is my bottom line , the minimum salary I can accept . __eou__",white
I don't . I like the work . __eou__,white
"Detached . You're literally detached from one planet , captured by another . Your only link to reality is the Earth out there ; fortunate - 1y , it stays in view the whole time .",green
Saturday is fine . I'll make dinner reservations for 7 o ’ clock . Is that ok ?,black
"Of course ! Everyday , there is a deadline to meet . Bosses watching and testing me all the time , not liking in college , handed in paper months later and tested on schedule . It is so busy . But anyway , I have trying my best to be a good employee .",white
Get out of here !,red
"Excellent , come over at ten o'clock and we will start at the shopping center , the one around the corner from my house . They have just the shop we need . __eou__",yellow
I've had enough of that !,red
I think someone is stalking me .,red
"I wouldn ’ t exactly characterize it in that way . I think something happened . Something terrible and unexpected that made it impossible for him to ... what if he showed up , took one look at me and left ?",red
So how about an aperitif ?,green
"Yes , I ache all over .",red
I drink a lot of wine .,red
"Hi , nice to hear from you , when does your plane leave ?",black
"I was , but then I discovered you can find out everything for free on the internet , so I ’ m not a member now .",black
"Oh , you mean palm reading . I've seen that before , but I don't believe in it .",black
Have you been to Shanghai before ?,black
"I've been trying to call him for the last ten minutes , but your line was busy . Will he be back soon ?",black
"Well , let me know when you can get it fixed . I ’ d love to go for a ride in it ! __eou__",yellow
Good morning . My name is Penny White . I'm new here .,yellow
We were planning on walking both ways since the weather is still nice .,green
"that's funny , I didn't know a big fellow like you could be so soft and timid on the inside .",black
"I have to do some things , and besides , it's not polite to be nosey .",red
I must apologize . I'll buy you a new one tomorrow .,red
"Oh , George , what a beautiful day it is today ! The sun is hot and there are just a few clouds scattered here and there ! What a perfect day to be at the beach ! The kids are going to have so much fun ! And we ’ ll be able to relax in the sun while they ’ re playing .",black
"You , too ! See you tomorrow . __eou__",white
"Everything is fine , and how are you ?",white
One moment and I'll check . __eou__,white
"you know , I often overhear our neighbor , the young couple , fighting about how to raise their kid and I really don't want kids to spoil our happiness .",black
I ’ ll till the soil and then sow the seeds . I ’ ll then add some fertilizer and voila ! Gardening all done !,green
"I don't like it . I am not used to this kind of 9 to 5 work hours . Above all , I hate talking to those poker faces everyday .",black
I see .,red
"At first it was , but now I've got the basics.It ' s fun . __eou__",green
"I tend to work well with people who are confident and straightforward.It ' s more difficult for me to be around timid people , because I move quickly and I am decisive .",black
That sounds very good . Which website should I visit to download it ?,white
I've never been to a restaurant like this before .,green
"The initial amount is just 2,000 RIB , but we can go up to 100,000 RIB . But remember , it cannot exceed the amount on the certificates you are using as collateral .",green
"Ok , see you 10 o'clock next Monday !",black
Me too . Do you think we are boring people ?,white
"Fine , just get it ! We have been shopping for furniture for five hours ! I ’ m so tired !",red
"But , Boris , i am not a baby any more .",green
"really well , thanks .",white
"He had barely survived the third audition and finally got a chance to advance in the contest . Fortunately , in the third audition , he has won popularity among the audience . And that's when I started to notice him .",black
Why don ’ t we go for Teppanyaki tonight ?,green
"She is the mature , stable , feminine type . I hope one day I can marry her .",white
"No , ties . And there's a tie store . Let's go ! __eou__",green
"Are you sure ? All the big cities have specialty shops , which sell all sorts of ethnic foods .",green
I really think we should take a tour of the White House .,green
Are you serious ? Gambling is a vice industry built on deception and fed by the intentional exploitation of human weakness for the sole purpose of monetary gain ! It disgusts me .,red
Haven't you heard that your novel has won The Nobel Prize ?,white
"Well , I hope scientists don ’ t decode to make a clone of me in the future ! I wouldn ’ t like to be the subject of an experiment . __eou__",yellow
Oh . You're new to smoking still . I've been smoking for 7 years .,black
It will do you good to go out for entertainment at weekends.What kind of movie do you like best ?,white
"I'm very well , thank you.How are you ?",yellow
Autumn is also very nice in Washington .,yellow
( When they are dancing ) You dance gracefully ! __eou__,yellow
I'm sorry . I've lost my tags and receipt . How can I do about it ?,red
Then stay away . Nobody's keeping you from doing that .,red
So how much should I gamble ?,white
"If you're in school , you can get a student pass .",green
There was no reason for them to arrest me .,red
"Well , it looks like his encouragement paid off Rebecca . So how about extracurricular activities at University ?",black
But are the public schools good everywhere ?,green
"It's no use complaining.If we had got enough money , we wouldn't put up with it ! __eou__",red
We're forming a study group to prepare for the finals . Do you want to join us ?,green
"Well , I ’ Ve always wanted to have lots of children . Growing up with only one brother , I always felt a bit lonely . What do you think about families with only one child ?",black
"I passed college English Test Band - 4 , with good skill in listening , speaking , reading and writing . I haven't got any certificate of computer skills , because I don ’ t think certificates are necessary if what's needed is merely operating a computer . I think , to know how to use a computer is more important . And I'm quite familiar with Microsoft Office __eou__",white
Thanks for the advice . I'll talk to my fiance about it tonight .,white
I could meet with you tomorrow anywhere from two until four ; what time works out best ?,green
"It's good , try it . What do you think ?",green
I'm sorry man . I didn't know . I didn't mean to screw anything up .,red
There are two ways to respond . You can either come back with another offer or go with their counter-offer .,green
That's it ! That ’ s the one I was thinking of ! I told you I'd remember it !,yellow
"Well , that ’ s just it . It did have some very dramatic and intense scenes For example when Mufasal dies , or the dark , grim portrayal of Scar . Even so , the film is linear . Mufasal dies , Simba runs away thinking it ’ s his fault . Falls in love and returns to retake what is rightfully his . It ’ s just too cliche .",black
I'm sorry . I must have made a mistake . I'll bring them for you at once .,red
I think so . Maybe that ’ s why it ’ s cheap here . __eou__,red
It ’ s a pity we can ’ t afford a house . A garden would be so nice .,red
How can we avoid the jam ?,green
Who's your favorite film star ?,white
"Oh , I don ’ t know ... it ’ s hard to find the right nanny . You have to consider her previous work experience , the responsibilities you give her , and how she interacts with the kids . I would love to have",green
"Well , actually in most cases we don't talk about special deals , but since this one is so new I will listen to what you have to say .",black
You mean the one starring John Travolta ?,yellow
I know a mover which has a very good reputation for their service . I ’ ll leave you their phone number .,green
"Oh , as simple as that ! I shall never wait for a real person again , these machines are wonderful . __eou__",green
"I didn't do anything . Finally , he left.But then I saw him again today . Outside the shoe store . Near the cafe . I went into a CD store and pretended I was looking at CD's . But then he came in too .",red
We can get both at the cafeteria . __eou__,green
"Oh , yes , indeed . I've run out of steam . To be honest , I want to be in a different environment .",red
"thanks , sir . __eou__",white
I was anxious to find out what the sellers had to say about my counter-offer .,red
"That ’ s all right . Let me see , oh , that lace looks so unique , and it ’ s so creative to make a picture display here . How did you get that idea ?",green
"The door bell doesn't work , the sink is leaking , there's no hot water , and the building is falling apart !",red
Three-but there was one of them who kept asking really stupid questions .,red
How about this sunday ?,yellow
I always like to go for a walk before a supper .,black
"if you can choose , will you marry a foreigner or a Chinese ?",white
"Certainly ! The first thing is to be honest about how much time for you can devote to your pet . Dogs are very demanding . You need to take them for walks and they love to play . Cats , on the other hand , are more independent .",green
That's what I've heard .,yellow
"If you ask me , I have to disagree . Something shouldn't be watched for fun . __eou__",white
"Ur , it stinks !",red
Finding the beautiful woman in a red dress next to the fountain wasn't all that hard .,yellow
"That's easy , how about a cowgirl ? Oh I know even better , a Canadian Mountie .",yellow
No . I only want it to be a very good one . The best.It ' s a graduation gift for my son .,green
That's fine .,yellow
"Generally speaking , we can if we go at this speed and nothing unexpected happens .",green
"Fine , then ! If that ’ s the way you feel , so be it . But you ’ re losing out on a great opportunity here . I ’ m going to go hit up Mum for the cash . __eou__",red
I am really sorry to hear that .,red
"Good morning , Emma ! A lovely day , isn't it ?",yellow
What would you like to see in Beijing ?,white
"Sorry , but I'm not really that interested in those things .",red
Then when do you think we could go out together ?,white
"Where do you wish me to take you , sir ?",green
What an attractive place ! How can I get there ?,yellow
I thought they had already agreed to everything . That ’ s going to take weeks to rework . __eou__,red
"Yes , since 1993 , I ’ Ve been employed as a clerk in the Beijing Branch of the DHAK Trading Corporation .",black
That sounds good but I don ’ t know what ’ s on .,yellow
It is ok . You look really pale and red eyes . I suggest you go home immediately and have a good rest .,black
Is this your first time to come to a symphony concert ?,black
"Something awful happened . We went to the Portobello Road , and someone stole my handbag .",red
I have little chance to communicate with colleagues when I have problems . They are always too busy to help a green hand like me .,red
"Yes , in some ways it was a step down from my previous job but it did offer me much better prospects for the future . __eou__",white
"I could handle everything pretty well in the old position , so I decided to move around and learn something new .",black
"And I ’ m trying to watch the game , but you ’ re yapping on about your new clothes !",red
"It's a beautiful day , isn't it ?",yellow
I would like to watch the Oscars on tv tonight . How about you ?,white
How is the college search going ?,black
"Fred and David , my college class mates and Rachel .",yellow
Good idea ! __eou__,white
What was the movie you saw last night ?,black
"Confronted with difficult questions in an interview , the job-hunters mostly will be at a loss about what to do .",white
What style would you prefer ?,green
OK . Do you want to ask the receptionist to wait for our customers at the receptionist counter before the meeting ?,black
"Yes , the recent agreements between the two governments have changed everything.Now we have the right to sell in America at a much lower tariff.It ' s going to be good . We can compete more directly with them .",green
"Thanks , it hasn ’ t been easy , but luckily we have life insurance and Wendy left behind a detailed will that will sort out any other legal matters . __eou__",black
"Tracing back , Yoga has a very long history . It was originated before India had approved Yoga and these documents were arranged and written according to the contents passed by mouth to mouth . In other words , Yoga is passed down from ancient times , which cannot be recalled . __eou__",green
"Okay , thank you . __eou__",yellow
"Absolutely . Mm , this is really good .",green
"That ’ s what you said the last time ! If you want to smoke , you ’ ll have to use your break time and go outside !",red
That ’ ll be most helpful .,white
And you think about her all the time ?,yellow
Everything in this magazine seems expensive . You could probably find something similar in a discount store .,green
"No , she also died when my step-brother was little . My mother and my step-father met each other shortly after my father died and became good friends . They ended up getting married a few years later .",black
"Come to my house for Thanksgiving ! We are having turkey , pumpkin pie , mashed potatoes with gravy , and lots of stuffing !",black
I just got fired .,white
Let ’ s meet in front of the train station .,yellow
"Here , try this one . It ’ s a good site about Gettysburg .",black
I will.Bye - bye !,white
"Well , let me see some of each .",green
Julia Roberts .,white
"I ’ m sorry , Mr . Baker ’ s not in . May I take your message ?",red
Do you mean the ' I love you ' virus that attacks computers through e-mail ?,white
I agree . And some cartoons are entertaining even for adults .,green
Yesterday I had a quarrel with my roommate . I'm really fed up with all this .,red
"I ’ m going there for a tour , too . Is this your first trip to China ?",yellow
It doesn't work . It looks like it's broken . I need to get to a hospital . You should drive me there .,red
"Take some thick clothes with you . It is rather cold there at night . If you wear the T-shirt you're wearing now , you will become a ' popsicle ' .",green
I'm terribly sorry to have caused you so much trouble .,red
We can play together if you are free .,yellow
Not at all.This dress certainly shows your good taste .,yellow
Yes . My house is far away from here . May I ask for an apartment ?,black
"No problem . Let's say 6:30 p . m . at the Royal Restaurant , OK ?",yellow
"According to the report , our Boston crowd is quite different make-up from our Chicago folks . Our Boston consumers are mostly from mid-level to upper-class income levels , university or postgraduates , married no children , white collar ... You know the kind . Chicago on the other hand is mostly mid to low income levels , single parent homes , blue collar ... I think we're talking about two totally different target groups .",black
It has been 12 years since it was founded in 1998 .,black
"Yes , but Americans never visit without calling in advance , and they almost never stay overnight .",black
Is a family like yours common in South Korea ?,black
"I would like to take this opportunity to welcome Monica to our company and introduce her to her department and colleagues . For all of you , we hired Monica because she is a very professional accountant and we are very happy to have her in the finance department . She has lots of working experiences as an accountant and I am sure everybody in the department can benefit from this .",black
"Here it is , and here we are .",yellow
I would love to have a home with a view .,green
"She ’ s my wife ! Oh , here ’ s my floor ! Nice talking to you . Goodbye .",yellow
"Alex , you don't know what to order . Let's go to a Chinese restaurant together next time .",green
Never mind . There's an authentic tasting hotpot restaurant not far from the China World Trade Towers on Chang An Street . Have you been there ?,black
"Exactly . We play every Saturdays on the field by the tennis courts . If you want to learn and play a little , you're welcome to join us .",yellow
We are nor alone here . So many other families !,green
I am awfully sorry . I didn't think you would mind so much .,red
Every chance I get . On weekends I ski all day long . Sometimes I even ski at night .,black
Fantastic ! I ’ ll be there ! __eou__,white
"No , rice isn't grown in France . But farming , fishing and industry are also very important in France . I'd like to go to Japan some day . Would you like to visit France ?",black
Very much . New York is such a nice place . Shall I show you some photographs ?,white
Of course . Let's go . __eou__,yellow
We have to wait six more minutes ! __eou__,red
You're quite welcome . Thank you for calling . Bye-byeB __eou__,yellow
What ? You feel sorry for the butterflies ?,white
Your English is fluent .,yellow
It ’ s my treat this time .,yellow
"Oh , lilies of the valley . No , I am sorry . We are all out of them right now .",red
We are going to have a picnic tomorrow at the picnic center .,yellow
What else should we do now after the floors are done and after the furniture is in ?,green
"Well , let's see.Why don't we go dancing for a change ? We haven't done that for a long time .",black
"You speak good English , though .",yellow
Tom did me many favors .,yellow
We should plan to move out of here before July . I'm tired of living in apartments .,red
You think it's funny . I'm terrified .,red
Even the roller coasters that go through tunnels in the dark ?,yellow
"Yes , but there is nothing inside the drawers or on the desk .",red
John is a peacemaker . He simply doesn ’ t bother . He says he should give him a free hand . __eou__,white
Oh no . I broke your vase accidentally .,red
"That doesn ’ t sound too bad . Great for sunbathing ! The coast of my country changes even within a few kilometers . There are cliffs , then sandy beaches . Then rocks . There are lots of caves in the cliffs . There are also many small islands off the coast , but few people lives on them .",black
"Very well , thanks . Nice to see you again . I haven't seen you for a long time . What have you been doing lately ?",black
"If you want to cross here , be my guest . I don't feel like dodging cars and scooters ! __eou__",red
"Right ! Anyway , the basic difference between a digital camcorder and its traditional counterpart is that it speaks digital .",yellow
"Well , it's specially made of a platinum alloy , sir , and the lustre will never fade out .",green
"Hey , Jack , where's your car ?",white
I'm afraid I can't go to the pictures with you tomorrow .,red
I got to meet the night Anger today too . We got along right from the start .,black
"Great idea ! Peter , I could use the drink .",yellow
"So , got any more ideas for the website ?",green
Would you like to go to a party tonight ?,yellow
How annoying !,red
Sounds good to me . The guy at the top gets money and so do the people below him .,yellow
"Well , the Great Wall of China , the Taj Mahal in India .",green
"Mike , you're late again .",red
"Jill , how do you like your new job ?",white
"We have reduced emission of air pollutants in recent years , but cars are still a major source of them . Factories have become cleaner as stricter environment pollution law have been introduced .",black
"Yes , my watch says a quarter to seven . but there is something wrong with my watch !",red
I don't think so . Dick has been on the ball and he never does things like that .,white
"( After they entering the park ) Great , it's so quiet here . We have the park to ourselves , only you and me .",black
"I ’ m really sorry , Mr . Samuel . I really don ’ t remember that . __eou__",red
"Well , it's important that you sit with him and review his homework assignments and help him with math . I would also recommend he stay after school twice a week for tutoring sessions . It will really help a lot .",green
Oh . I just wanted you to shut up . You were off-key anyway . Let me see that !,red
That's terrible .,red
That's all right . I'm almost finished . Do you need my help ?,yellow
"Of course , I have . There is one in my old house . And I have another one from college at my parents ' house .",green
"Yes , there is , drinking your coffee ! __eou__",green
I just lost my job . I'm just worried about how I'm going to pay the bills .,red
"Well , it's not as crowded as we expected , is it ?",green
What about the one on the Yellow River Road ?,green
"Oh , hi ! I'm Barbara Johnson . Nice to meet you .",white
"exactly . You know , the sunshine and wind remind me of our honeymoon . You remember ? The island , the sound of the waves , the salty sea air and the sunshine ...",yellow
"Oh , great . That's just my luck ! I hate those arty movies .",red
"Oh , Penny , I'm Leonard , glad to meet you .",yellow
No problem . See you next Monday . __eou__,white
Thanks for helping me move into my new house .,yellow
Don't worry about money . I'll treat you tonight .,yellow
"Yes , I really weak in maps , I did poorly in high school .",red
"Bob , I'm really upset with you .",red
Thanks for reminding me . I ’ Ve prepared some party games for the children too .,yellow
It's great ! The mountains here are beautiful and the skiing is spectacular.Have you been here for a long time ?,black
John made out with other girls at the party yesterday . __eou__,white
"let ’ s think . He loves football , doesn ’ t he ? I saw signed photographs of famous footballers in a shop near hear . Let ’ s go and have a look . You know which team he supports , don ’ t you ?",green
It's taking you forever to do my hair .,red
The chicken is out of this world !,yellow
Really ? Why not ? She looks great .,white
"Well we have espresso , cappuccino , latte , skinny latte or Americano .",green
I failed my oral test .,red
"No , I just check my weight , I'm getting fatter .",red
"Oh , come on ! Failure is the mother of success . Don ’ t lose heart . I'm sure you'll succeed .",yellow
A :: Very well . How's Mrs Clinton ?,white
The job market is so competitive nowadays . I want to develop some useful skills .,green
"I know . But we could get some exercise in , and we could get some errands run , too . Window-shopping won ’ t cost you anything .",green
You can't prick the fish to please the sick tastes of some bloody people .,red
The baby is crying again .,white
"One time , I tried garlic ice cream .",white
We have to find a shelter .,green
It says here that it ’ s mainly used for big football matches and athletics meetings .,black
There's been bad blood between them since Bobbie took away John's girlfriend . __eou__,black
What's the bonus like at your company ?,white
"It wouldn't be worth the trouble in that case , would it ? Let's still use cartons .",white
Whatever meal that you plan on making .,green
"Can ’ t be better , it was wonderful . We had a lot of fun there . There was so much joy and walk and breathe the winter air . We arrived at the park at 9 o ’ clock in the morning and didn ’ t leave till 3 o ’ clock in the afternoon .",yellow
Would you please go to a dancing party with me ?,yellow
I'm afraid you can't .,red
"i have felt that . One day when i was in a queue , reading a newspaper story , the man behind me peered through my shoulder and stared at the newspaper I was holding .",black
I can handle them without any trouble,black
I see . What about the salary ?,white
I can ’ t believe it ! I thought the Cougars were going to win for sure .,red
"Cafe au lait , cafe latte , cappuccino , cafe mocha ... I can't keep them all straight !",black
"Yes , do I have to work a whole year before I can take a vacation ?",black
yes . Do you intend to order a la carte or will you be having our seafood buffet ?,white
Thank you for that . And I will double your pay . __eou__,white
233-331-8828 . Let me give you my email address too . It's Tom861@gmail.com,yellow
"Then , why didn't you try to prevent it in the beginning ?",red
Make it three cups . Here comes Harry . __eou__,yellow
"I think the starting salary for a salesperson is between 1,500 - 2,000 Yuan . But the specific number will be determined according to your sales .",black
Silly me .,red
"Sure , I advise the sightseeing buses .",green
"Yes , I have . But I have to wait . __eou__",red
"Five o ’ clock that afternoon , and in my place , you know ?",yellow
"Yeah , I ’ m better after talking to you .",red
Silly me !,red
I would say do not make the e-mail exchange too long . A lot of times a connection via e-mail creates almost a false sense of intimacy . Quickly make sure there is a connection in the physical world .,black
"How do you do , Mr . James ? Thank you for asking me to come in .",yellow
"You said it . Ok , let's go in , Sandy . __eou__",yellow
"OK , I suppose , but she's had a rough time in the last few years , She got divorced .",white
"Fine , how are you doing ?",white
"Listen to the music ? And who will cook dinner , will you ?",red
"But look , it's so sunny out .",green
Tomorrow is my wife's birthday . We both love spicy Chinese dishes . I am wondering if you could recommend a good local restaurant where I can find some good spicy dishes .,black
And so I bought all these books on having kids and ...,yellow
"Oh , yes , I have . I worked part-time as a typewriter in a computer company when I was at college .",black
Look behind us at the mountains ! They're reflecting pink !,yellow
I don't know what to say . This can't be happening . Here's the obituary .,black
